{
  "schemaVersion": 1,
  "release": "foundation-example-release",
  "generation": 1,
  "baseCommit": "aaaaaaaaaaaaaaaaaaaaaaaaaaaaaaaaaaaaaaaa",
  "late": false,
  "intent": {
    "recordedAt": "2026-01-01T00:00:00+00:00",
    "goal": "<one-line description of the intended LLM configuration change>",
    "expectedEffects": [
      "<what should observably change once this ships>"
    ],
    "successCriteria": [
      "<one condition that must hold for this to count as correct>"
    ],
    "nonGoals": [
      "<something this change explicitly does not try to fix>"
    ]
  },
  "review": {
    "reviewedAt": "2026-01-02T00:00:00+00:00",
    "reviewedCommit": "bbbbbbbbbbbbbbbbbbbbbbbbbbbbbbbbbbbbbbbb",
    "correctness": "pass",
    "procedure": "good",
    "criteriaResults": [
      {
        "criterion": "<one condition that must hold for this to count as correct>",
        "result": "met",
        "evidence": "<what was observed that supports this result>"
      }
    ],
    "observedEffects": [
      "<what was actually observed to change>"
    ],
    "procedureChecks": {
      "minimalChange": "yes",
      "verifiedBeforeProceeding": "yes",
      "rollbackPreserved": "yes",
      "stableIsolationUsed": "yes"
    },
    "betterProcedure": "none",
    "verdict": "accepted"
  }
}
